{
  "version": 1,
  "segment": "Fiagro",
  "segmentKey": "fiagro",
  "generatedAt": "2026-10-24T14:30:00Z",
  "lookbackDays": 14,
  "sources": [
    "fiis.com.br",
    "fundsexplorer.com.br",
    "infomoney.com.br",
    "moneytimes.com.br",
    "statusinvest.com.br",
    "suno.com.br"
  ],
  "funds": [
    {
      "ticker": "KNCA11",
      "sentiment": "positive",
      "score": 0.5,
      "confidence": "medium",
      "summary": "O Kinea Crédito Agro pagou R$ 0,93 por cota em 14/10 (yield de 1,08%), acima dos R$ 0,85 de setembro. O InfoMoney registrou alta de 6,4% entre 2 e 9/10; em 23/10 a cota fechou a R$ 91,60, com P/VP de 0,91, e o Status Invest aponta valorização de 7,61% no mês.",
      "articleCount": 3,
      "topHeadlines": [
        {
          "title": "Fiagros colhem até 11% em uma semana, mas ainda enfrentam praga da inadimplência",
          "url": "https://www.infomoney.com.br/onde-investir/fiagros-colhem-ate-11-em-uma-semana-mas-ainda-enfrentam-praga-da-inadimplencia/",
          "publishedAt": "2026-10-16"
        },
        {
          "title": "KNCA11 - FIAGRO KINEA: cotação e histórico de dividendos",
          "url": "https://fiis.com.br/knca11/",
          "publishedAt": "2026-10-23"
        },
        {
          "title": "KNCA11 - KINEA CRÉDITO AGRO FIAGRO: dividendos",
          "url": "https://statusinvest.com.br/fiagros/knca11"
        }
      ]
    },
    {
      "ticker": "SNAG11",
      "sentiment": "positive",
      "score": 0.65,
      "confidence": "medium",
      "summary": "O Suno Agro pagou R$ 0,12 por cota em 23/10, yield mensal de 1,21% sobre o fechamento de R$ 9,91 em 30/09. A Fiis relatou a compra de quatro CRAs de proteína animal, com carrego a CDI + 2,76% e inadimplência zero.",
      "articleCount": 3,
      "topHeadlines": [
        {
          "title": "SNAG11 paga dividendos hoje de 1,21%; veja valor",
          "url": "https://fiis.com.br/noticias/snag11-paga-dividendos-hoje-de-121-veja-valor/",
          "publishedAt": "2026-10-23"
        },
        {
          "title": "Fundos da Suno anunciam dividendos de até 15,99%; veja valores e data",
          "url": "https://www.suno.com.br/noticias/fundos-suno-anunciam-dividendos-outubro-rendimentos-datas-pagamento-vi/",
          "publishedAt": "2026-10-16"
        },
        {
          "title": "Fundos da Suno anunciam dividendos de até 15,99%; veja valores e data",
          "url": "https://fiis.com.br/noticias/fundos-da-suno-anunciam-dividendos-de-ate-1599-veja-valores-e-data/",
          "publishedAt": "2026-10-16"
        }
      ]
    },
    {
      "ticker": "RBRF11",
      "sentiment": "neutral",
      "score": 0,
      "confidence": "low",
      "summary": "Sem cobertura nos portais permitidos nos últimos 14 dias. A página do RBRF11 no Fiis não lista proventos e a última atualização do conteúdo é de 02/10/2025.",
      "articleCount": 0,
      "topHeadlines": []
    },
    {
      "ticker": "SNCI11",
      "sentiment": "positive",
      "score": 0.25,
      "confidence": "medium",
      "summary": "O Suno Recebíveis manteve R$ 1,00 por cota, com data-base em 15/10 e pagamento em 23/10. A Suno informou retorno mensal de 1,21%; o calendário do fiis.com.br aponta dividend yield de 1,14% nesse crédito.",
      "articleCount": 3,
      "topHeadlines": [
        {
          "title": "Fundos da Suno anunciam dividendos de até 15,99%; veja valores e data",
          "url": "https://www.suno.com.br/noticias/fundos-suno-anunciam-dividendos-outubro-rendimentos-datas-pagamento-vi/",
          "publishedAt": "2026-10-16"
        },
        {
          "title": "Confira quais FIIs pagam dividendos hoje; XPML está na lista",
          "url": "https://www.suno.com.br/noticias/dividendos-hoje-8-fiis-pagam/",
          "publishedAt": "2026-10-23"
        },
        {
          "title": "XPML11 e mais 64 FIIs pagam dividendos na semana; veja quais",
          "url": "https://fiis.com.br/noticias/dividendos-de-fiis-65-fundos-imobiliarios-pagam-esta-semana-outubro-jj/",
          "publishedAt": "2026-10-19"
        }
      ]
    },
    {
      "ticker": "XPCA11",
      "sentiment": "neutral",
      "score": 0.1,
      "confidence": "medium",
      "summary": "O XP Crédito Agrícola manteve R$ 0,10 por cota, pago em 15/10 (yield de 1,33%). Em 23/10 a cota fechou a R$ 7,79, com P/VP de 0,81 e dividend yield de 16,43% em 12 meses.",
      "articleCount": 2,
      "topHeadlines": [
        {
          "title": "169 fundos imobiliários pagam proventos hoje (15), com valores de até R$ 180 por cota; IFIX avança",
          "url": "https://www.moneytimes.com.br/169-fundos-imobiliarios-pagam-proventos-hoje-15-com-valores-de-ate-r-180-por-cota-ifix-sobe-igdl/",
          "publishedAt": "2026-10-15"
        },
        {
          "title": "XPCA11 - FIAGRO XP CA: cotação e histórico de dividendos",
          "url": "https://fiis.com.br/xpca11/",
          "publishedAt": "2026-10-23"
        }
      ]
    },
    {
      "ticker": "VGIA11",
      "sentiment": "neutral",
      "score": 0.1,
      "confidence": "low",
      "summary": "O Valora CRA manteve R$ 0,12 por cota (data-base 13/10, pagamento 20/10, yield de 1,33%), o mesmo valor de setembro e abaixo dos R$ 0,13 de agosto. Em 23/10 a cota fechou a R$ 9,10, com P/VP de 0,95.",
      "articleCount": 1,
      "topHeadlines": [
        {
          "title": "VGIA11 - FIAGRO VGIA: cotação e histórico de dividendos",
          "url": "https://fiis.com.br/vgia11/",
          "publishedAt": "2026-10-23"
        }
      ]
    },
    {
      "ticker": "BTAG11",
      "sentiment": "neutral",
      "score": 0.15,
      "confidence": "medium",
      "summary": "O BTG Pactual Crédito Agrícola manteve R$ 1,30 por cota (data-base 07/10, pagamento 15/10, yield de 1,33%). Em 23/10 a cota fechou a R$ 94,82, com P/VP de 0,90 e dividend yield de 16,66% em 12 meses.",
      "articleCount": 2,
      "topHeadlines": [
        {
          "title": "169 fundos imobiliários pagam proventos hoje (15), com valores de até R$ 180 por cota; IFIX avança",
          "url": "https://www.moneytimes.com.br/169-fundos-imobiliarios-pagam-proventos-hoje-15-com-valores-de-ate-r-180-por-cota-ifix-sobe-igdl/",
          "publishedAt": "2026-10-15"
        },
        {
          "title": "BTAG11 - FIAGRO BTAG: cotação e histórico de dividendos",
          "url": "https://fiis.com.br/btag11/",
          "publishedAt": "2026-10-23"
        }
      ]
    },
    {
      "ticker": "ZAVI11",
      "sentiment": "positive",
      "score": 0.3,
      "confidence": "medium",
      "summary": "O Zavit manteve R$ 0,12 por cota, pago em 14/10 (yield de 1,23%). Em 23/10 a cota fechou a R$ 9,92, com P/VP de 0,70.",
      "articleCount": 2,
      "topHeadlines": [
        {
          "title": "MXRF11, BRCO11: 180 FIIs pagam dividendos na semana; veja os valores",
          "url": "https://fiis.com.br/noticias/fiis-fundos-imobiliarios-calendario-pagamento-semana-outubro-2026-jj/",
          "publishedAt": "2026-10-13"
        },
        {
          "title": "ZAVI11 - FII-ZAVIT-R: cotação e histórico de dividendos",
          "url": "https://fiis.com.br/zavi11/",
          "publishedAt": "2026-10-23"
        }
      ]
    },
    {
      "ticker": "KNHF11",
      "sentiment": "positive",
      "score": 0.45,
      "confidence": "medium",
      "summary": "O Kinea Hedge Fund manteve R$ 1,00 por cota, pago em 13/10 (yield de 1,08%); em 23/10 a cota fechou a R$ 96,61, com P/VP de 0,98. O BTG Pactual elevou o peso do KNHF11 para 6,5% na carteira recomendada de outubro, em relatório que cita um cenário mais construtivo para o equilíbrio fiscal.",
      "articleCount": 3,
      "topHeadlines": [
        {
          "title": "FIIs e FI-Infra: Os melhores fundos para investir em outubro, segundo o BTG",
          "url": "https://www.moneytimes.com.br/fiis-e-fi-infra-os-melhores-fundos-para-investir-em-outubro-segundo-o-btg-igdl/",
          "publishedAt": "2026-10-10"
        },
        {
          "title": "MXRF11, BRCO11: 180 FIIs pagam dividendos na semana; veja os valores",
          "url": "https://fiis.com.br/noticias/fiis-fundos-imobiliarios-calendario-pagamento-semana-outubro-2026-jj/",
          "publishedAt": "2026-10-13"
        },
        {
          "title": "KNHF11 - KINEA HEDGE FUND: cotação e histórico de dividendos",
          "url": "https://fiis.com.br/knhf11/",
          "publishedAt": "2026-10-23"
        }
      ]
    },
    {
      "ticker": "SNFZ11",
      "sentiment": "positive",
      "score": 0.45,
      "confidence": "medium",
      "summary": "O Suno Fazendas manteve R$ 0,10 por cota (data-base 15/10, pagamento 23/10), com retorno mensal de 1,10% segundo a Suno. A mesma cobertura relata a conclusão, em julho, da compra de três fazendas no Mato Grosso arrendadas à Jequitibá Agro, com vacância física e financeira zerada.",
      "articleCount": 2,
      "topHeadlines": [
        {
          "title": "Fundos da Suno anunciam dividendos de até 15,99%; veja valores e data",
          "url": "https://www.suno.com.br/noticias/fundos-suno-anunciam-dividendos-outubro-rendimentos-datas-pagamento-vi/",
          "publishedAt": "2026-10-16"
        },
        {
          "title": "Fundos da Suno anunciam dividendos de até 15,99%; veja valores e data",
          "url": "https://fiis.com.br/noticias/fundos-da-suno-anunciam-dividendos-de-ate-1599-veja-valores-e-data/",
          "publishedAt": "2026-10-16"
        }
      ]
    },
    {
      "ticker": "AGRX11",
      "sentiment": "positive",
      "score": 0.25,
      "confidence": "medium",
      "summary": "O Éxes Araguaia manteve R$ 0,12 por cota (data-base 07/10, pagamento 15/10, yield de 1,48%). Em 23/10 a cota fechou a R$ 8,10, com P/VP de 0,77 e dividend yield de 18,02% em 12 meses.",
      "articleCount": 2,
      "topHeadlines": [
        {
          "title": "169 fundos imobiliários pagam proventos hoje (15), com valores de até R$ 180 por cota; IFIX avança",